Model,Beschrijving,Art (вҳ…),Prompting (вҳ…),Realism (вҳ…),Typography (вҳ…),Kosten ($),Type
HiDream I1 Dev,Maakt verbluffende artistieke afbeeldingen met uitzonderlijke helderheid en detail.,вҳ…вҳ…вҳ…вҳ…вҳ…,вҳ…вҳ…вҳ…вҳҶвҳҶ,вҳ…вҳ…вҳ…вҳ…вҳҶ,вҳ…вҳ…вҳҶвҳҶвҳҶ,$$$$$,Image
Flux,Een geweldig algemeen model voor lage kosten.,вҳ…вҳ…вҳ…вҳ…вҳҶ,вҳ…вҳ…вҳ…вҳ…вҳҶ,вҳ…вҳ…вҳ…вҳ…вҳҶ,вҳ…вҳ…вҳ…вҳҶвҳҶ,$$$$,Image
Clarity Upscaler,Een creatieve upscaler die detail toevoegt en opschaalt tot 4x.,вҳ…вҳ…вҳ…вҳҶвҳҶ,вҳ…вҳ…вҳ…вҳҶвҳҶ,вҳ…вҳ…вҳ…вҳ…вҳҶ,вҳ…вҳ…вҳҶвҳҶвҳҶ,$$$$,Image
Flux 2 Klein 9B Fast,Flux 2 Klein 9B is een 4-stap gedistilleerd beeldgeneratie en bewerkingsmodel.,вҳ…вҳ…вҳҶвҳҶвҳҶ,вҳ…вҳ…вҳҶвҳҶвҳҶ,вҳ…вҳ…вҳ…вҳҶвҳҶ,вҳ…вҳ…вҳҶвҳҶвҳҶ,$$$$,Image
Nano Banana Pro,De volgende versie van Nano Banana met verbeterde mogelijkheden en prestaties.,вҳ…вҳ…вҳ…вҳҶвҳҶ,вҳ…вҳ…вҳ…вҳ…вҳҶ,вҳ…вҳ…вҳҶвҳҶвҳҶ,вҳ…вҳ…вҳҶвҳҶвҳҶ,$$$$$,Image
Seedream 4.0,Next-gen multimodaal AI model voor ultra-snelle hoge resolutie generatie (2K-4K).,вҳ…вҳ…вҳ…вҳ…вҳҶ,вҳ…вҳ…вҳ…вҳ…вҳҶ,вҳ…вҳ…вҳ…вҳ…вҳҶ,вҳ…вҳ…вҳ…вҳҶвҳҶ,$$$$$,Image
Z-Image Turbo,Een betaalbaar model met geweldige kwaliteit voor lage kosten.,вҳ…вҳ…вҳ…вҳ…вҳҶ,вҳ…вҳ…вҳ…вҳ…вҳҶ,вҳ…вҳ…вҳ…вҳ…вҳҶ,вҳ…вҳ…вҳ…вҳҶвҳҶ,$$$$,Image
Nano Banana,AKA Gemini Flash 2.5 - Google's nieuwste model met first-class startafbeelding ondersteuning.,вҳ…вҳ…вҳ…вҳҶвҳҶ,вҳ…вҳ…вҳ…вҳ…вҳҶ,вҳ…вҳ…вҳ…вҳҶвҳҶ,вҳ…вҳ…вҳҶвҳҶвҳҶ,$$$$$,Image
Seedream 4.5,Een verbeterde versie van Seedream 4.0.,вҳ…вҳ…вҳ…вҳ…вҳҶ,вҳ…вҳ…вҳ…вҳ…вҳҶ,вҳ…вҳ…вҳ…вҳ…вҳ…,вҳ…вҳ…вҳ…вҳҶвҳҶ,$$$$,Image
HiDream I1 Fast,"Snellere en goedkopere versie van HiDream, geweldig voor artistieke afbeeldingen.",вҳ…вҳ…вҳ…вҳ…вҳҶ,вҳ…вҳ…вҳ…вҳҶвҳҶ,вҳ…вҳ…вҳ…вҳ…вҳҶ,вҳ…вҳ…вҳҶвҳҶвҳҶ,$$$$$,Image
Seedream 3.0,Een model van ByteDance met focus op realisme en detail.,вҳ…вҳ…вҳ…вҳ…вҳҶ,вҳ…вҳ…вҳ…вҳ…вҳҶ,вҳ…вҳ…вҳ…вҳ…вҳ…,вҳ…вҳ…вҳ…вҳҶвҳҶ,$$$$$,Image
Qwen Image 2512,Qwen's nieuwste update met grote verbeteringen in realisme. Fotorealistische mensen.,вҳ…вҳ…вҳ…вҳ…вҳҶ,вҳ…вҳ…вҳ…вҳ…вҳҶ,вҳ…вҳ…вҳ…вҳ…вҳ…,вҳ…вҳ…вҳ…вҳ…вҳҶ,$$$$,Image
Qwen Image Edit 2511,"Behoudt mensen en texturen goed, ongeacht aanpassingen.",вҳ…вҳ…вҳ…вҳ…вҳҶ,вҳ…вҳ…вҳ…вҳ…вҳҶ,вҳ…вҳ…вҳ…вҳ…вҳ…,вҳ…вҳ…вҳ…вҳҶвҳҶ,$$$$,Edit
Flux 2 Klein 4B Fast,De snelste variant in de Klein familie. Gebouwd voor interactieve toepassingen en realtime gebruik.,вҳ…вҳ…вҳ…вҳҶвҳҶ,вҳ…вҳ…вҳ…вҳ…вҳҶ,вҳ…вҳ…вҳ…вҳҶвҳҶ,вҳ…вҳ…вҳҶвҳҶвҳҶ,$$$$$,Image
Flux 2 Klein 4B,Een kleiner basismodel met uitzonderlijke kwaliteit-grootte verhouding. Ideaal voor efficiГ«nt gebruik.,вҳ…вҳ…вҳ…вҳҶвҳҶ,вҳ…вҳ…вҳ…вҳ…вҳҶ,вҳ…вҳ…вҳ…вҳ…вҳҶ,вҳ…вҳ…вҳҶвҳҶвҳҶ,$$$$,Image
Flux 2 Klein 9B,Uitstekende kwaliteit bij sub-seconde snelheid. Geweldig voor realtime generatie.,вҳ…вҳ…вҳ…вҳҶвҳҶ,вҳ…вҳ…вҳ…вҳ…вҳҶ,вҳ…вҳ…вҳ…вҳ…вҳҶ,вҳ…вҳ…вҳҶвҳҶвҳҶ,$$$$,Image
Qwen Image,Een model van Alibaba dat uitblinkt in typografie.,вҳ…вҳ…вҳ…вҳ…вҳҶ,вҳ…вҳ…вҳ…вҳ…вҳҶ,вҳ…вҳ…вҳ…вҳҶвҳҶ,вҳ…вҳ…вҳ…вҳ…вҳ…,$$$$,Image
Qwen Image SD,Een goedkopere lagere resolutie versie van Qwen Image.,вҳ…вҳ…вҳ…вҳҶвҳҶ,вҳ…вҳ…вҳ…вҳ…вҳҶ,вҳ…вҳ…вҳ…вҳҶвҳҶ,вҳ…вҳ…вҳ…вҳ…вҳҶ,$$$$,Image
Flux 2 Dev,"Baseline Flux 2, goed in alles en voor redelijke kosten.",вҳ…вҳ…вҳ…вҳ…вҳҶ,вҳ…вҳ…вҳ…вҳ…вҳҶ,вҳ…вҳ…вҳ…вҳ…вҳҶ,вҳ…вҳ…вҳ…вҳҶвҳҶ,$$$,Image
Flux 2 Pro,Flux 2 met verbeterde beeldkwaliteit en goed voor fotorealisme.,вҳ…вҳ…вҳ…вҳ…вҳҶ,вҳ…вҳ…вҳ…вҳ…вҳ…,вҳ…вҳ…вҳ…вҳ…вҳ…,вҳ…вҳ…вҳ…вҳҶвҳҶ,$$$$,Image
Flux 2 Flex,"Flux 2, beter voor typografie en designs.",вҳ…вҳ…вҳ…вҳ…вҳҶ,вҳ…вҳ…вҳ…вҳ…вҳҶ,вҳ…вҳ…вҳ…вҳ…вҳҶ,вҳ…вҳ…вҳ…вҳ…вҳ…,$$$$,Image
Flux 2 Max,Gegronding generatie met echte context. Maximum kwaliteit voor complexe workflows.,вҳ…вҳ…вҳ…вҳ…вҳ…,вҳ…вҳ…вҳ…вҳ…вҳ…,вҳ…вҳ…вҳ…вҳ…вҳ…,вҳ…вҳ…вҳ…вҳ…вҳ…,$$$$$,Image
Flux Krea,Maakt realistische afbeeldingen met focus op correcte menselijke anatomie.,вҳ…вҳ…вҳ…вҳ…вҳҶ,вҳ…вҳ…вҳ…вҳ…вҳҶ,вҳ…вҳ…вҳ…вҳ…вҳ…,вҳ…вҳ…вҳ…вҳҶвҳҶ,$$$$,Image
Flux Schnell,"Een goedkopere, snellere maar iets minder krachtige versie van Flux.",вҳ…вҳ…вҳ…вҳ…вҳҶ,вҳ…вҳ…вҳ…вҳ…вҳҶ,вҳ…вҳ…вҳ…вҳ…вҳҶ,вҳ…вҳ…вҳ…вҳҶвҳҶ,$$$$,Image
Google Imagen 4.0 Fast,"Een snellere goedkopere versie van Imagen v4, Google's beeldmodel.",вҳ…вҳ…вҳ…вҳ…вҳҶ,вҳ…вҳ…вҳ…вҳ…вҳҶ,вҳ…вҳ…вҳ…вҳ…вҳҶ,вҳ…вҳ…вҳ…вҳ…вҳҶ,$$$$,Image
Google Imagen 4.0,Google's beeldmodel. Geweldig voor prompt-naleving en typografie.,вҳ…вҳ…вҳ…вҳ…вҳҶ,вҳ…вҳ…вҳ…вҳ…вҳ…,вҳ…вҳ…вҳ…вҳ…вҳ…,вҳ…вҳ…вҳ…вҳ…вҳ…,$$$$,Image
Qwen Image Edit Plus,AKA Qwen Image Edit 2509 - Verbeterde versie van Qwen-Image-Edit met multi-image ondersteuning.,вҳ…вҳ…вҳ…вҳ…вҳҶ,вҳ…вҳ…вҳ…вҳ…вҳҶ,вҳ…вҳ…вҳ…вҳ…вҳ…,вҳ…вҳ…вҳ…вҳҶвҳҶ,$$$$,Edit
Qwen Image Edit,Geavanceerde beeldbewerkingsmogelijkheden met Qwen AI.,вҳ…вҳ…вҳ…вҳ…вҳҶ,вҳ…вҳ…вҳ…вҳ…вҳҶ,вҳ…вҳ…вҳ…вҳ…вҳҶ,вҳ…вҳ…вҳ…вҳҶвҳҶ,$$$$,Edit
Flux Kontext Dev,"Goedkopere en snellere versie van Kontext, goed in het bewerken via prompts.",вҳ…вҳ…вҳ…вҳҶвҳҶ,вҳ…вҳ…вҳ…вҳ…вҳ…,вҳ…вҳ…вҳ…вҳ…вҳҶ,вҳ…вҳ…вҳ…вҳҶвҳҶ,$$$$$,Edit
Flux PRO v1.1,De volledige krachtige versie van Flux door Black Forest Labs.,вҳ…вҳ…вҳ…вҳ…вҳ…,вҳ…вҳ…вҳ…вҳ…вҳ…,вҳ…вҳ…вҳ…вҳ…вҳ…,вҳ…вҳ…вҳ…вҳҶвҳҶ,$$$$$,Image
HiDream I1 Full,"De volledige kracht van HiDream I1, een geavanceerd beeldgeneratiemodel.",вҳ…вҳ…вҳ…вҳ…вҳ…,вҳ…вҳ…вҳ…вҳ…вҳҶ,вҳ…вҳ…вҳ…вҳ…вҳҶ,вҳ…вҳ…вҳ…вҳҶвҳҶ,$$$$$,Image
Ideogram V3 Turbo,Het nieuwste turbo model van Ideogram.,вҳ…вҳ…вҳ…вҳ…вҳҶ,вҳ…вҳ…вҳ…вҳ…вҳ…,вҳ…вҳ…вҳ…вҳ…вҳҶ,вҳ…вҳ…вҳ…вҳ…вҳ…,$$$$,Image
Dreamshaper XL Lightning,Een snel goedkoop model dat goed is in kunst en realisme.,вҳ…вҳ…вҳ…вҳ…вҳҶ,вҳ…вҳ…вҳ…вҳ…вҳҶ,вҳ…вҳ…вҳ…вҳ…вҳҶ,вҳ…вҳ…вҳ…вҳҶвҳҶ,$$$$$,Image
Google Imagen 4.0 Ultra,"Een grotere versie van Imagen v4, Google's nieuwste beeldmodel.",вҳ…вҳ…вҳ…вҳ…вҳ…,вҳ…вҳ…вҳ…вҳ…вҳ…,вҳ…вҳ…вҳ…вҳ…вҳ…,вҳ…вҳ…вҳ…вҳ…вҳ…,$$$$$,Image
Flux PRO v1.1 Ultra,Ultra hoge resolutie versie van Flux door Black Forest Labs.,вҳ…вҳ…вҳ…вҳ…вҳ…,вҳ…вҳ…вҳ…вҳ…вҳ…,вҳ…вҳ…вҳ…вҳ…вҳ…,вҳ…вҳ…вҳ…вҳ…вҳҶ,$$$$$,Image
Flux Kontext Pro,Uitstekend in het bewerken van afbeeldingen via natuurlijke taal prompts.,вҳ…вҳ…вҳ…вҳҶвҳҶ,вҳ…вҳ…вҳ…вҳ…вҳ…,вҳ…вҳ…вҳ…вҳ…вҳҶ,вҳ…вҳ…вҳ…вҳҶвҳҶ,$$$$$,Edit
Flux Kontext Max,Een krachtigere versie van Flux Kontext voor beeldbewerking via tekstprompts.,вҳ…вҳ…вҳ…вҳҶвҳҶ,вҳ…вҳ…вҳ…вҳ…вҳ…,вҳ…вҳ…вҳ…вҳ…вҳҶ,вҳ…вҳ…вҳ…вҳҶвҳҶ,$$$$,Edit
Ideogram V3 Quality,Het nieuwste en beste model van Ideogram.,вҳ…вҳ…вҳ…вҳ…вҳ…,вҳ…вҳ…вҳ…вҳ…вҳ…,вҳ…вҳ…вҳ…вҳ…вҳҶ,вҳ…вҳ…вҳ…вҳ…вҳ…,$$$$$,Image
DALL-E 3,Beeldmodel van OpenAI. Geweldig voor creatieve artistieke prompts.,вҳ…вҳ…вҳ…вҳ…вҳ…,вҳ…вҳ…вҳ…вҳ…вҳ…,вҳ…вҳ…вҳ…вҳ…вҳҶ,вҳ…вҳ…вҳ…вҳҶвҳҶ,$$$$$,Image
GPT1.5 Medium,Het nieuwste model van OpenAI op gemiddelde kwaliteitsinstelling. Ondersteunt prompt-to-edit.,вҳ…вҳ…вҳ…вҳ…вҳ…,вҳ…вҳ…вҳ…вҳ…вҳ…,вҳ…вҳ…вҳ…вҳ…вҳ…,вҳ…вҳ…вҳ…вҳ…вҳҶ,$$$$$,Image
GPT1.5 High,Het nieuwste model van OpenAI op hoge kwaliteitsinstelling. Ondersteunt prompt-to-edit.,вҳ…вҳ…вҳ…вҳ…вҳ…,вҳ…вҳ…вҳ…вҳ…вҳ…,вҳ…вҳ…вҳ…вҳ…вҳ…,вҳ…вҳ…вҳ…вҳ…вҳ…,$$$$,Image
GPT1 Medium,Het nieuwste flagship beeldmodel van OpenAI op gemiddelde kwaliteitsinstelling.,вҳ…вҳ…вҳ…вҳ…вҳ…,вҳ…вҳ…вҳ…вҳ…вҳ…,вҳ…вҳ…вҳ…вҳ…вҳ…,вҳ…вҳ…вҳ…вҳ…вҳҶ,$$$$$,Image
GPT1 High,Het nieuwste flagship beeldmodel van OpenAI op hoge kwaliteitsinstelling.,вҳ…вҳ…вҳ…вҳ…вҳ…,вҳ…вҳ…вҳ…вҳ…вҳ…,вҳ…вҳ…вҳ…вҳ…вҳ…,вҳ…вҳ…вҳ…вҳ…вҳ…,$$$$$,Image
Ideogram V3,Het nieuwste model van Ideogram.,вҳ…вҳ…вҳ…вҳ…вҳ…,вҳ…вҳ…вҳ…вҳ…вҳ…,вҳ…вҳ…вҳ…вҳ…вҳҶ,вҳ…вҳ…вҳ…вҳ…вҳ…,$$$$,Image
Google Imagen 3.0 Fast,"Een snellere goedkopere versie van Imagen v3, Google's beeldmodel.",вҳ…вҳ…вҳ…вҳ…вҳҶ,вҳ…вҳ…вҳ…вҳ…вҳҶ,вҳ…вҳ…вҳ…вҳ…вҳҶ,вҳ…вҳ…вҳ…вҳ…вҳҶ,$$$$,Image
Google Imagen 3.0,Google's beeldmodel. Geweldig voor prompt-naleving en typografie.,вҳ…вҳ…вҳ…вҳ…вҳҶ,вҳ…вҳ…вҳ…вҳ…вҳ…,вҳ…вҳ…вҳ…вҳ…вҳ…,вҳ…вҳ…вҳ…вҳ…вҳ…,$$$$,Image
Ideogram 2a,Gemaakt door ex-Googlers. Betaalbare prompt-naleving en typografie.,вҳ…вҳ…вҳ…вҳ…вҳҶ,вҳ…вҳ…вҳ…вҳ…вҳ…,вҳ…вҳ…вҳ…вҳ…вҳҶ,вҳ…вҳ…вҳ…вҳ…вҳ…,$$$,Image
Ideogram 2a Turbo,Een snellere goedkopere versie van Ideogram 2a.,вҳ…вҳ…вҳ…вҳ…вҳҶ,вҳ…вҳ…вҳ…вҳ…вҳҶ,вҳ…вҳ…вҳ…вҳ…вҳҶ,вҳ…вҳ…вҳ…вҳ…вҳ…,$$$,Image
GPT1.5 Low,GPT Image 1.5 van OpenAI op lage kwaliteitsinstelling. Snel en goedkoop voor prototypes.,вҳ…вҳ…вҳ…вҳҶвҳҶ,вҳ…вҳ…вҳ…вҳ…вҳҶ,вҳ…вҳ…вҳ…вҳҶвҳҶ,вҳ…вҳ…вҳ…вҳҶвҳҶ,$$$$$,Image
GPT1 Low,GPT Image 1 van OpenAI op lage kwaliteitsinstelling. Snel en goedkoop voor prototypes.,вҳ…вҳ…вҳ…вҳҶвҳҶ,вҳ…вҳ…вҳ…вҳ…вҳҶ,вҳ…вҳ…вҳ…вҳҶвҳҶ,вҳ…вҳ…вҳ…вҳҶвҳҶ,$$$$,Image
Recraft v3,Model door Recraft. Uitstekend voor spelling en typografie. Kan vectoren genereren.,вҳ…вҳ…вҳ…вҳҶвҳҶ,вҳ…вҳ…вҳ…вҳ…вҳ…,вҳ…вҳ…вҳ…вҳҶвҳҶ,вҳ…вҳ…вҳ…вҳ…вҳ…,$$$$$,Image
Ideogram 2.0,Gemaakt door ex-Googlers. Geweldig voor prompt-naleving en tekst in afbeeldingen.,вҳ…вҳ…вҳ…вҳ…вҳҶ,вҳ…вҳ…вҳ…вҳ…вҳ…,вҳ…вҳ…вҳ…вҳ…вҳҶ,вҳ…вҳ…вҳ…вҳ…вҳ…,$$$$$,Image
Ideogram 2.0 Turbo,Een snellere goedkopere versie van Ideogram 2.0. Geweldig voor typografie.,вҳ…вҳ…вҳ…вҳ…вҳҶ,вҳ…вҳ…вҳ…вҳ…вҳ…,вҳ…вҳ…вҳ…вҳҶвҳҶ,вҳ…вҳ…вҳ…вҳ…вҳ…,$$$$$,Image
Ideogram 1.0,Het eerste model van Ideogram. Goed voor typografie.,вҳ…вҳ…вҳ…вҳ…вҳҶ,вҳ…вҳ…вҳ…вҳ…вҳҶ,вҳ…вҳ…вҳ…вҳҶвҳҶ,вҳ…вҳ…вҳ…вҳ…вҳҶ,$$$$$,Image
Ideogram 1.0 Turbo,Een snellere en goedkopere versie van Ideogram 1.0.,вҳ…вҳ…вҳ…вҳ…вҳҶ,вҳ…вҳ…вҳ…вҳ…вҳҶ,вҳ…вҳ…вҳ…вҳҶвҳҶ,вҳ…вҳ…вҳ…вҳ…вҳҶ,$$$$$,Image
Seedance 1.5 Pro,De volgende generatie AI videogeneratie met gesynchroniseerde audio mogelijkheden.,вҳ…вҳ…вҳ…вҳ…вҳ…,вҳ…вҳ…вҳ…вҳ…вҳ…,вҳ…вҳ…вҳ…вҳ…вҳ…,вҳ…вҳ…вҳҶвҳҶвҳҶ,$$$$$,Video
Seedance 1.0 Pro Fast,Snellere videogeneratie. Lagere prijs. Cinematografische resultaten.,вҳ…вҳ…вҳ…вҳ…вҳҶ,вҳ…вҳ…вҳ…вҳ…вҳҶ,вҳ…вҳ…вҳ…вҳ…вҳҶ,вҳ…вҳ…вҳҶвҳҶвҳҶ,$$$$,Video
PixVerse V5,PixVerse's v5 model met de nieuwste ontwikkelingen in AI videogeneratie.,вҳ…вҳ…вҳ…вҳ…вҳ…,вҳ…вҳ…вҳ…вҳ…вҳ…,вҳ…вҳ…вҳ…вҳ…вҳ…,вҳ…вҳ…вҳҶвҳҶвҳҶ,$$$$$,Video
Kling 2.5 Turbo Standard,Ontworpen voor vloeiende cinematografische beeld-naar-video generatie door Kling A.I.,вҳ…вҳ…вҳ…вҳ…вҳҶ,вҳ…вҳ…вҳ…вҳ…вҳҶ,вҳ…вҳ…вҳ…вҳ…вҳҶ,вҳ…вҳ…вҳҶвҳҶвҳҶ,$$$$$,Video
Veo 3.1,Levensechte beweging met contextbewuste gesynchroniseerde audio. Ondersteunt eerste en laatste frame.,вҳ…вҳ…вҳ…вҳ…вҳ…,вҳ…вҳ…вҳ…вҳ…вҳ…,вҳ…вҳ…вҳ…вҳ…вҳ…,вҳ…вҳ…вҳҶвҳҶвҳҶ,$$$$$,Video
Veo 3.1 Fast,Maakt dynamische cinematografische video's van Г©Г©n afbeelding met levensechte beweging en gesynchroniseerde audio.,вҳ…вҳ…вҳ…вҳ…вҳҶ,вҳ…вҳ…вҳ…вҳ…вҳ…,вҳ…вҳ…вҳ…вҳ…вҳ…,вҳ…вҳ…вҳҶвҳҶвҳҶ,$$$$,Video
Google Veo 3.0 Fast,Een tekst-naar-video en beeld-naar-video model door Google.,вҳ…вҳ…вҳ…вҳ…вҳҶ,вҳ…вҳ…вҳ…вҳ…вҳ…,вҳ…вҳ…вҳ…вҳ…вҳҶ,вҳ…вҳ…вҳҶвҳҶвҳҶ,$$$$,Video
Seedance 1.0 Pro,Een tekst-naar-video en beeld-naar-video model door ByteDance AI.,вҳ…вҳ…вҳ…вҳ…вҳҶ,вҳ…вҳ…вҳ…вҳ…вҳҶ,вҳ…вҳ…вҳ…вҳ…вҳҶ,вҳ…вҳ…вҳҶвҳҶвҳҶ,$$$$$,Video
Seedance 1.0 Lite,Een tekst-naar-video en beeld-naar-video model door ByteDance AI.,вҳ…вҳ…вҳ…вҳҶвҳҶ,вҳ…вҳ…вҳ…вҳ…вҳҶ,вҳ…вҳ…вҳ…вҳ…вҳҶ,вҳ…вҳ…вҳҶвҳҶвҳҶ,$$$$,Video
Kling 2.5 Turbo Pro,Een tekst-naar-video en beeld-naar-video model door Kling A.I. met turbo beweging.,вҳ…вҳ…вҳ…вҳ…вҳҶ,вҳ…вҳ…вҳ…вҳ…вҳ…,вҳ…вҳ…вҳ…вҳ…вҳ…,вҳ…вҳ…вҳҶвҳҶвҳҶ,$$$$$,Video
Kling 2.1 Standard,Een beeld-naar-video model door Kling A.I.,вҳ…вҳ…вҳ…вҳ…вҳҶ,вҳ…вҳ…вҳ…вҳ…вҳҶ,вҳ…вҳ…вҳ…вҳ…вҳҶ,вҳ…вҳ…вҳҶвҳҶвҳҶ,$$$$$,Video
Kling 1.6 Standard,Een tekst-naar-video en beeld-naar-video model door Kling A.I.,вҳ…вҳ…вҳ…вҳҶвҳҶ,вҳ…вҳ…вҳ…вҳ…вҳҶ,вҳ…вҳ…вҳ…вҳ…вҳҶ,вҳ…вҳ…вҳҶвҳҶвҳҶ,$$$$,Video
Runway Gen-4 Turbo,Het nieuwste beeld-naar-video model door Runway.,вҳ…вҳ…вҳ…вҳ…вҳҶ,вҳ…вҳ…вҳ…вҳ…вҳ…,вҳ…вҳ…вҳ…вҳ…вҳ…,вҳ…вҳ…вҳҶвҳҶвҳҶ,$$$$$,Video
Juggernaut Flux Base,Een versie van Flux getraind op hoogwaardige afbeeldingen. Door RunDiffusion.,вҳ…вҳ…вҳ…вҳ…вҳ…,вҳ…вҳ…вҳ…вҳ…вҳҶ,вҳ…вҳ…вҳ…вҳ…вҳ…,вҳ…вҳ…вҳ…вҳҶвҳҶ,$$$,Image
Juggernaut Flux Pro,Flux maar beter (vooral voor realisme). Door RunDiffusion.,вҳ…вҳ…вҳ…вҳ…вҳ…,вҳ…вҳ…вҳ…вҳ…вҳ…,вҳ…вҳ…вҳ…вҳ…вҳ…,вҳ…вҳ…вҳ…вҳҶвҳҶ,$$$$,Image
Juggernaut Flux Lightning,Een goedkopere snellere maar iets minder krachtige versie van Juggernaut Flux.,вҳ…вҳ…вҳ…вҳ…вҳҶ,вҳ…вҳ…вҳ…вҳ…вҳҶ,вҳ…вҳ…вҳ…вҳ…вҳ…,вҳ…вҳ…вҳ…вҳҶвҳҶ,$$$,Image
Juggernaut XI,Juggernaut opnieuw getraind voor betere prompt-naleving. Door RunDiffusion.,вҳ…вҳ…вҳ…вҳ…вҳ…,вҳ…вҳ…вҳ…вҳ…вҳ…,вҳ…вҳ…вҳ…вҳ…вҳ…,вҳ…вҳ…вҳ…вҳҶвҳҶ,$$$$,Image
Juggernaut XI Lightning,"Juggernaut opnieuw getraind voor betere prompt-naleving. Door RunDiffusion.",вҳ…вҳ…вҳ…вҳ…вҳ…,вҳ…вҳ…вҳ…вҳ…вҳ…,вҳ…вҳ…вҳ…вҳ…вҳ…,вҳ…вҳ…вҳ…вҳҶвҳҶ,$$$$,Image
RealVisXL v5,"Een SDXL model voor fotorealisme. Geweldig voor gezichten. Door SG_161222.",вҳ…вҳ…вҳ…вҳ…вҳҶ,вҳ…вҳ…вҳ…вҳ…вҳҶ,вҳ…вҳ…вҳ…вҳ…вҳ…,вҳ…вҳ…вҳҶвҳҶвҳҶ,$$$$,Image
RealVisXL v5 Lightning,"Een SDXL lightning model voor fotorealisme. Geweldig voor gezichten. Door SG_161222.",вҳ…вҳ…вҳ…вҳ…вҳҶ,вҳ…вҳ…вҳ…вҳ…вҳҶ,вҳ…вҳ…вҳ…вҳ…вҳ…,вҳ…вҳ…вҳҶвҳҶвҳҶ,$$$$,Image
Crystal Clear XL,"Een SDXL model voor fotorealisme, 3D, semi-realistisch of cartoonachtig. Door Team Crystal.",вҳ…вҳ…вҳ…вҳ…вҳҶ,вҳ…вҳ…вҳ…вҳ…вҳҶ,вҳ…вҳ…вҳ…вҳ…вҳ…,вҳ…вҳ…вҳҶвҳҶвҳҶ,$$$$,Image
Crystal Clear XL Lightning,"Een SDXL model voor fotorealisme, 3D, semi-realistisch of cartoonachtig. Door Team Crystal.",вҳ…вҳ…вҳ…вҳ…вҳҶ,вҳ…вҳ…вҳ…вҳ…вҳҶ,вҳ…вҳ…вҳ…вҳ…вҳҶ,вҳ…вҳ…вҳҶвҳҶвҳҶ,$$$$,Image
Boltning XL v1 Lightning,"Een lightning model voor zeer gedetailleerde esthetische afbeeldingen. Door georgebanjog.",вҳ…вҳ…вҳ…вҳ…вҳ…,вҳ…вҳ…вҳ…вҳ…вҳҶ,вҳ…вҳ…вҳ…вҳ…вҳҶ,вҳ…вҳ…вҳҶвҳҶвҳҶ,$$$$$,Image
Atomix XL v4 Lightning,"Een lightning model dat realisme en CG balanceert. Door AlexLai.",вҳ…вҳ…вҳ…вҳ…вҳҶ,вҳ…вҳ…вҳ…вҳ…вҳҶ,вҳ…вҳ…вҳ…вҳ…вҳҶ,вҳ…вҳ…вҳҶвҳҶвҳҶ,$$$$,Image
Moxie Diffusion XL v1.6 Lightning,"Een mashup van populaire SDXL modellen. Door moxie1776.",вҳ…вҳ…вҳ…вҳ…вҳҶ,вҳ…вҳ…вҳ…вҳ…вҳҶ,вҳ…вҳ…вҳ…вҳ…вҳҶ,вҳ…вҳ…вҳҶвҳҶвҳҶ,$$$$,Image
RealVisXL v4,"Een SDXL model voor fotorealisme. Geweldig voor gezichten. Door SG_161222.",вҳ…вҳ…вҳ…вҳ…вҳҶ,вҳ…вҳ…вҳ…вҳ…вҳҶ,вҳ…вҳ…вҳ…вҳ…вҳ…,вҳ…вҳ…вҳҶвҳҶвҳҶ,$$$$,Image
Stable Core,"Mooie hoge resolutie afbeeldingen zonder complexe prompts.",вҳ…вҳ…вҳ…вҳ…вҳҶ,вҳ…вҳ…вҳ…вҳ…вҳ…,вҳ…вҳ…вҳ…вҳ…вҳҶ,вҳ…вҳ…вҳ…вҳҶвҳҶ,$$$$$,Image
SDXL 1.0,"Stabiel Diffusie XL. Een ouder model dat nog steeds goed presteert.",вҳ…вҳ…вҳ…вҳ…вҳҶ,вҳ…вҳ…вҳ…вҳ…вҳҶ,вҳ…вҳ…вҳ…вҳ…вҳҶ,вҳ…вҳ…вҳ…вҳҶвҳҶ,$$$$,Image
RealVisXL v4 Lightning,"Een SDXL model voor fotorealisme. Geweldig voor gezichten. Door SG_161222.",вҳ…вҳ…вҳ…вҳ…вҳҶ,вҳ…вҳ…вҳ…вҳ…вҳҶ,вҳ…вҳ…вҳ…вҳ…вҳ…,вҳ…вҳ…вҳҶвҳҶвҳҶ,$$$$,Image
Fluently XL,"Een SDXL model voor het maken van realistische afbeeldingen. Door Fluently.",вҳ…вҳ…вҳ…вҳ…вҳҶ,вҳ…вҳ…вҳ…вҳ…вҳҶ,вҳ…вҳ…вҳ…вҳ…вҳ…,вҳ…вҳ…вҳҶвҳҶвҳҶ,$$$$,Image
Fluently XL Lightning,"Een SDXL lightning model voor realistische afbeeldingen. Door Fluently.",вҳ…вҳ…вҳ…вҳ…вҳҶ,вҳ…вҳ…вҳ…вҳ…вҳҶ,вҳ…вҳ…вҳ…вҳ…вҳ…,вҳ…вҳ…вҳҶвҳҶвҳҶ,$$$$$,Image
Real Cartoon XL v4,"Een SDXL model goed voor realistisch ogende cartoons. Door 7whitefire7.",вҳ…вҳ…вҳ…вҳ…вҳ…,вҳ…вҳ…вҳ…вҳҶвҳҶ,вҳ…вҳ…вҳ…вҳҶвҳҶ,вҳ…вҳ…вҳҶвҳҶвҳҶ,$$$$,Image
Starlight XL,"Een SDXL model voor concept art en illustraties. Door chillpixel.",вҳ…вҳ…вҳ…вҳ…вҳ…,вҳ…вҳ…вҳ…вҳ…вҳҶ,вҳ…вҳ…вҳ…вҳҶвҳҶ,вҳ…вҳ…вҳҶвҳҶвҳҶ,$$$$,Image
Mysterious XL v4,"Een SDXL model voor fantasy kunst en Aziatische cultuur. Door LahInTheFutureland.",вҳ…вҳ…вҳ…вҳ…вҳ…,вҳ…вҳ…вҳ…вҳҶвҳҶ,вҳ…вҳ…вҳ…вҳҶвҳҶ,вҳ…вҳ…вҳҶвҳҶвҳҶ,$$$$,Image
Juggernaut XL v8,"Een SDXL model voor perfecte realisme en cinematografische stijlen. Door KandooAI.",вҳ…вҳ…вҳ…вҳ…вҳ…,вҳ…вҳ…вҳ…вҳ…вҳҶ,вҳ…вҳ…вҳ…вҳ…вҳ…,вҳ…вҳ…вҳҶвҳҶвҳҶ,$$$$,Image
DreamShaper XL alpha2,"Een veelzijdig SDXL model getraind door Lykon.",вҳ…вҳ…вҳ…вҳ…вҳҶ,вҳ…вҳ…вҳ…вҳ…вҳҶ,вҳ…вҳ…вҳ…вҳ…вҳҶ,вҳ…вҳ…вҳ…вҳҶвҳҶ,$$$$$,Image
Juggernaut XL v5,"Een SDXL model voor perfecte realisme en cinematografische stijlen. Door KandooAI.",вҳ…вҳ…вҳ…вҳ…вҳ…,вҳ…вҳ…вҳ…вҳ…вҳҶ,вҳ…вҳ…вҳ…вҳ…вҳ…,вҳ…вҳ…вҳҶвҳҶвҳҶ,$$$$,Image
Juggernaut XL v6,"Een SDXL model voor perfecte realisme en cinematografische stijlen. Door KandooAI.",вҳ…вҳ…вҳ…вҳ…вҳ…,вҳ…вҳ…вҳ…вҳ…вҳҶ,вҳ…вҳ…вҳ…вҳ…вҳ…,вҳ…вҳ…вҳҶвҳҶвҳҶ,$$$$,Image
Juggernaut XL v7,"Een SDXL model voor perfecte realisme en cinematografische stijlen. Door KandooAI.",вҳ…вҳ…вҳ…вҳ…вҳ…,вҳ…вҳ…вҳ…вҳ…вҳҶ,вҳ…вҳ…вҳ…вҳ…вҳ…,вҳ…вҳ…вҳҶвҳҶвҳҶ,$$$$,Image
Juggernaut v9 Lightning,"Een lightning model voor perfecte realisme en cinematografische stijlen. Door RunDiffusion.",вҳ…вҳ…вҳ…вҳ…вҳҶ,вҳ…вҳ…вҳ…вҳ…вҳҶ,вҳ…вҳ…вҳ…вҳ…вҳ…,вҳ…вҳ…вҳҶвҳҶвҳҶ,$$$$,Image
Juggernaut v9,"Een SDXL model voor perfecte realisme en cinematografische stijlen. Door RunDiffusion.",вҳ…вҳ…вҳ…вҳ…вҳҶ,вҳ…вҳ…вҳ…вҳ…вҳҶ,вҳ…вҳ…вҳ…вҳ…вҳ…,вҳ…вҳ…вҳҶвҳҶвҳҶ,$$$$,Image
Blue Pencil XL,"Een SDXL Anime model door blue_pen5805.",вҳ…вҳ…вҳ…вҳ…вҳ…,вҳ…вҳ…вҳ…вҳҶвҳҶ,вҳ…вҳ…вҳ…вҳҶвҳҶ,вҳ…вҳ…вҳҶвҳҶвҳҶ,$$$$,Image
Animagine XL v3,"Een model voor het genereren van hoogwaardige anime. Door CagliostroLab.",вҳ…вҳ…вҳ…вҳ…вҳ…,вҳ…вҳ…вҳ…вҳ…вҳҶ,вҳ…вҳ…вҳ…вҳҶвҳҶ,вҳ…вҳ…вҳҶвҳҶвҳҶ,$$$$,Image
RealVisXL v3,"Een SDXL model voor fotorealisme. Geweldig voor gezichten. Door SG_161222.",вҳ…вҳ…вҳ…вҳ…вҳҶ,вҳ…вҳ…вҳ…вҳ…вҳҶ,вҳ…вҳ…вҳ…вҳ…вҳ…,вҳ…вҳ…вҳҶвҳҶвҳҶ,$$$$,Image
AAM XL Anime Mix v1,"Een model voor anime en gestileerde kunst. Door Lykon.",вҳ…вҳ…вҳ…вҳ…вҳ…,вҳ…вҳ…вҳ…вҳҶвҳҶ,вҳ…вҳ…вҳ…вҳҶвҳҶ,вҳ…вҳ…вҳҶвҳҶвҳҶ,$$$$,Image
Virtual Utopia XL,"Geschikt voor zowel authentieke als anime afbeeldingen. Door CyberBlacat.",вҳ…вҳ…вҳ…вҳ…вҳҶ,вҳ…вҳ…вҳ…вҳ…вҳҶ,вҳ…вҳ…вҳ…вҳ…вҳҶ,вҳ…вҳ…вҳҶвҳҶвҳҶ,$$$$,Image
Cherry Picker XL v2.7,"Een fotorealistisch model dat zorgvuldig geselecteerde modellen combineert. Door tkvier.",вҳ…вҳ…вҳ…вҳ…вҳ…,вҳ…вҳ…вҳ…вҳ…вҳҶ,вҳ…вҳ…вҳ…вҳ…вҳ…,вҳ…вҳ…вҳҶвҳҶвҳҶ,$$$$,Image
SDXL LCM,"SDXL versneld door LCM LoRA. Hoge kwaliteit snel en goedkoop.",вҳ…вҳ…вҳ…вҳ…вҳҶ,вҳ…вҳ…вҳ…вҳ…вҳҶ,вҳ…вҳ…вҳ…вҳ…вҳҶ,вҳ…вҳ…вҳ…вҳҶвҳҶ,$$$$$,Image
SDXL DPO,"Een Direct Preference Optimization (DPO) versie van SDXL 1.0.",вҳ…вҳ…вҳ…вҳ…вҳҶ,вҳ…вҳ…вҳ…вҳ…вҳҶ,вҳ…вҳ…вҳ…вҳ…вҳҶ,вҳ…вҳ…вҳ…вҳҶвҳҶ,$$$$,Image
DreamShaper v8,"Een doet-het-allemaal model door Lykon. Bijzonder goed in kunst.",вҳ…вҳ…вҳ…вҳ…вҳ…,вҳ…вҳ…вҳ…вҳ…вҳҶ,вҳ…вҳ…вҳ…вҳ…вҳҶ,вҳ…вҳ…вҳ…вҳҶвҳҶ,$$$$,Image
Realistic Vision V5.1,"Een model voor fotorealisme. Geweldig voor gezichten. Door SG_161222.",вҳ…вҳ…вҳ…вҳ…вҳҶ,вҳ…вҳ…вҳ…вҳ…вҳҶ,вҳ…вҳ…вҳ…вҳ…вҳ…,вҳ…вҳ…вҳҶвҳҶвҳҶ,$$$$,Image
AbsoluteReality v1.8.1,"Een model gericht op realisme door Lykon.",вҳ…вҳ…вҳ…вҳ…вҳҶ,вҳ…вҳ…вҳ…вҳ…вҳҶ,вҳ…вҳ…вҳ…вҳ…вҳ…,вҳ…вҳ…вҳҶвҳҶвҳҶ,$$$$,Image
NeverEnding Dream v1.2.2,"Een DreamShaper alternatief dat beter is in anime. Door Lykon.",вҳ…вҳ…вҳ…вҳ…вҳҶ,вҳ…вҳ…вҳ…вҳ…вҳҶ,вҳ…вҳ…вҳ…вҳҶвҳҶ,вҳ…вҳ…вҳҶвҳҶвҳҶ,$$$$,Image
