Model,Beschrijving,Art (вҳ…),Prompting (вҳ…),Realism (вҳ…),Typography (вҳ…),Kosten ($),Type
3D Animation Diffusion v10,"Geweldig voor het maken van 3D cartoon karakters. Door Lykon.",вҳ…вҳ…вҳ…вҳ…вҳ…,вҳ…вҳ…вҳ…вҳ…вҳҶ,вҳ…вҳ…вҳ…вҳҶвҳҶ,вҳ…вҳ…вҳҶвҳҶвҳҶ,$$$$,Image
RPG v5,"Gericht op het maken van RPG karakter portretten. Door Anashel.",вҳ…вҳ…вҳ…вҳ…вҳ…,вҳ…вҳ…вҳ…вҳ…вҳҶ,вҳ…вҳ…вҳ…вҳҶвҳҶ,вҳ…вҳ…вҳҶвҳҶвҳҶ,$$$$,Image
Blue Pencil v10,"Gericht op anime en fantasy kunst. Door blue_pen5805.",вҳ…вҳ…вҳ…вҳ…вҳ…,вҳ…вҳ…вҳ…вҳҶвҳҶ,вҳ…вҳ…вҳ…вҳҶвҳҶ,вҳ…вҳ…вҳҶвҳҶвҳҶ,$$$$$,Image
Arthemy Comics v5.0,"Gericht op het maken van stripverhaal stijl karakters. Door Arthemy.",вҳ…вҳ…вҳ…вҳ…вҳ…,вҳ…вҳ…вҳ…вҳ…вҳҶ,вҳ…вҳ…вҳ…вҳҶвҳҶ,вҳ…вҳ…вҳҶвҳҶвҳҶ,$$$$,Image
Rabbit v7,"Dit model is geboren om schattige kleine dingen te tekenen. Door Rabbit_YourMajesty.",вҳ…вҳ…вҳ…вҳ…вҳ…,вҳ…вҳ…вҳ…вҳҶвҳҶ,вҳ…вҳ…вҳҶвҳҶвҳҶ,вҳ…вҳ…вҳҶвҳҶвҳҶ,$$$$,Image
Nightmare Shaper v3,"Ontworpen om de donkerste verbeeldingen los te laten. Door Yamer.",вҳ…вҳ…вҳ…вҳ…вҳ…,вҳ…вҳ…вҳ…вҳ…вҳҶ,вҳ…вҳ…вҳ…вҳҶвҳҶ,вҳ…вҳ…вҳҶвҳҶвҳҶ,$$$$,Image
WildlifeX Animals,"Model gericht op dieren, huisdieren en verschillende rassen. Door Mr_fries1111.",вҳ…вҳ…вҳ…вҳ…вҳ…,вҳ…вҳ…вҳ…вҳ…вҳҶ,вҳ…вҳ…вҳ…вҳ…вҳҶ,вҳ…вҳ…вҳҶвҳҶвҳҶ,$$$$,Image
RealCartoon Pixar v8,"Een SD1.5 model goed voor Pixar stijl cartoons. Door 7whitefire7.",вҳ…вҳ…вҳ…вҳ…вҳ…,вҳ…вҳ…вҳ…вҳҶвҳҶ,вҳ…вҳ…вҳ…вҳҶвҳҶ,вҳ…вҳ…вҳҶвҳҶвҳҶ,$$$$,Image
Ghost Mix v2,"Een SD1.5 model goed voor 2.5D kunst. Door _GhostInShell_.",вҳ…вҳ…вҳ…вҳ…вҳ…,вҳ…вҳ…вҳ…вҳҶвҳҶ,вҳ…вҳ…вҳ…вҳҶвҳҶ,вҳ…вҳ…вҳҶвҳҶвҳҶ,$$$$$,Image
Juggernaut Reborn,"Een SD 1.5 model voor perfecte realisme en cinematografische stijlen. Door KandooAI.",вҳ…вҳ…вҳ…вҳ…вҳҶ,вҳ…вҳ…вҳ…вҳ…вҳҶ,вҳ…вҳ…вҳ…вҳ…вҳ…,вҳ…вҳ…вҳҶвҳҶвҳҶ,$$$$$,Image
SD1.5 DPO,"Een Direct Preference Optimization (DPO) versie van SD1.5.",вҳ…вҳ…вҳ…вҳҶвҳҶ,вҳ…вҳ…вҳ…вҳҶвҳҶ,вҳ…вҳ…вҳ…вҳ…вҳҶ,вҳ…вҳ…вҳҶвҳҶвҳҶ,$$$$$,Image
DALL-E 2,"De originele beeldgenerator van OpenAI.",вҳ…вҳ…вҳ…вҳ…вҳҶ,вҳ…вҳ…вҳ…вҳ…вҳҶ,вҳ…вҳ…вҳ…вҳҶвҳҶ,вҳ…вҳ…вҳҶвҳҶвҳҶ,$$$,Image
Stable Diffusion 1.5,"Het meest populaire eerste generatie Stabiel Diffusie model.",вҳ…вҳ…вҳҶвҳҶвҳҶ,вҳ…вҳ…вҳҶвҳҶвҳҶ,вҳ…вҳ…вҳ…вҳҶвҳҶ,вҳ…вҳ…вҳҶвҳҶвҳҶ,$$$$$,Image
Stable Diffusion 1.4,"Het originele Stabiel Diffusie model.",вҳ…вҳ…вҳҶвҳҶвҳҶ,вҳ…вҳ…вҳҶвҳҶвҳҶ,вҳ…вҳ…вҳ…вҳҶвҳҶ,вҳ…вҳ…вҳҶвҳҶвҳҶ,$$$$,Image
Coherent,"CLIP-Guided Diffusion.",вҳ…вҳ…вҳҶвҳҶвҳҶ,вҳ…вҳ…вҳҶвҳҶвҳҶ,вҳ…вҳ…вҳҶвҳҶвҳҶ,вҳ…вҳҶвҳҶвҳҶвҳҶ,$$$$,Image
Artistic,"VQGAN+CLIP - het originele tekst-naar-afbeelding algoritme.",вҳ…вҳ…вҳҶвҳҶвҳҶ,вҳ…вҳҶвҳҶвҳҶвҳҶ,вҳ…вҳҶвҳҶвҳҶвҳҶ,вҳ…вҳҶвҳҶвҳҶвҳҶ,$$$$,Image
Style Transfer,"Het originele AI Art algoritme.",вҳ…вҳ…вҳҶвҳҶвҳҶ,вҳ…вҳҶвҳҶвҳҶвҳҶ,вҳ…вҳҶвҳҶвҳҶвҳҶ,вҳ…вҳҶвҳҶвҳҶвҳҶ,$$$$,Image
